Topic,Words,Frequency,Timestamp
0,"barsa, madrid, #chiringuitothebest, win, play",43,2023-02-28
1,"negreira, vase, mandril, simple, egreira",4,2023-02-28
2,"laugh, vinicius, massss, provocation, madrid",1,2023-02-28
3,"arbitration, document, case, negreira, revulsive",6,2023-02-28
4,"euros, collection, cash, bara, month",3,2023-02-28
5,"estrada, fernndez, @rsierraplus, lawsuit, job",1,2023-02-28
8,"imaginary, title, bastards, negreira, egreira",2,2023-02-28
9,"villar, case, ngel, @rojasruin, negreira",2,2023-02-28
12,"boy, singing, negreira, loud, idea",1,2023-02-28
13,"estrada, fernndez, @pedropparrado, goles, payer",1,2023-02-28
14,"investigation, uefa, court, case, high",3,2023-02-28
16,"referee, gulf, lima, convened, prez",2,2023-02-28
17,"case, negreira, bara, partner, happy",6,2023-02-28
18,"time, thing, negreira, egreira, club",1,2023-02-28
20,"uefa, sanctioning, fifa, year, case",3,2023-02-28
22,"martinez, carlos, surprise, goal, egreira",1,2023-02-28
24,"blah, madrid, negreira, aberrant, derision",3,2023-02-28
26,"cta, jewel, archive, pte, appointment",2,2023-02-28
28,"espai, investors, participate, suspense, caso",1,2023-02-28
33,"cup, benzem, robbed, prize, international",1,2023-02-28
35,"cantacerca, bleed, medina, prick, resign",1,2023-02-28
37,"spain, #mediador, farlopa, arguing, accurate",2,2023-02-28
39,"tough, shadow, var, fact, cta",1,2023-02-28
41,"gonzlez, var, dangerous, son, referee",1,2023-02-28
42,"#footballleaks, plague, document, major, payment",1,2023-02-28
47,"innings, ankle, negreira, withdrew, clamorous",2,2023-02-28
51,"kyojin, gameplay, calendar, shingeki, genshin",1,2023-02-28
0,"barsa, madrid, play, bar, win",247,2023-03-01
1,"negreira, egreira, pollo, buffoons, @aviajarblog",9,2023-03-01
2,"vinicius, referee, yellow, insult, thrown",1,2023-03-01
3,"case, arbitration, negreira, @10delbarca, rfef",4,2023-03-01
4,"cash, month, euros, collection, withdrew",42,2023-03-01
5,"estrada, fernndez, denounce, referee, sports",1,2023-03-01
6,"referee, negreira, @fcbarcelona_es, jordan, flavor",5,2023-03-01
7,"gavi, persuasive, dwarf, wn, sister",1,2023-03-01
8,"egreira, negreira, case, #negreira, fault",19,2023-03-01
9,"case, negreira, forgotten, civil, talk",19,2023-03-01
10,"negreira, #realmadridbarcelona, #copadelrey, @realmadrid, tomorrow",5,2023-03-01
11,"withdrew, cash, euros, month, collection",23,2023-03-01
12,"boy, eliminated, europe, negreira, egreira",1,2023-03-01
13,"estrada, fernndez, lawsuit, file, assumptions",2,2023-03-01
14,"uefa, case, criminals, negreira, spanish",5,2023-03-01
15,"negreira, levers, play, beat, enthusiasm",6,2023-03-01
16,"referee, gulf, lima, prez, negreira",11,2023-03-01
17,"bara, negreira, case, scandal, barcelona",17,2023-03-01
18,"malejo, ivn, infamous, catalan, negreira",1,2023-03-01
19,"paid, @ctarfef, negreira, pay, payment",1,2023-03-01
20,"uefa, sanctioning, fifa, case, negreira",7,2023-03-01
21,"cooler, interior, democracy, kitchen, play",1,2023-03-01
22,"goal, failed, negreira, offside, penalty",2,2023-03-01
23,"riffraff, mental, arbitration, retarded, solution",1,2023-03-01
24,"madrid, negreira, santiago, real, shout",4,2023-03-01
25,"bernabu, bernabeu, egreira, tra, atmosphere",3,2023-03-01
26,"cta, president, negreira, appointment, nicole",4,2023-03-01
27,"#barcagate, negreira, #baragate, bara, march",8,2023-03-01
28,"espai, investors, bara, case, reputation",21,2023-03-01
30,"banknotes, jules, verne, travel, pocket",1,2023-03-01
33,"cup, vini, shame, happened, negreira",1,2023-03-01
35,"harshly, #deportesentuits1572, lima, gulf, prez",1,2023-03-01
36,"enrquez, negreira, enriquez, ternurica, @jorgecalabres",6,2023-03-01
37,"wild, shout, pedredol, maje, #psoeputeroycocainmano",2,2023-03-01
38,"#golazo, thing, negreira, gun, spaghetti",5,2023-03-01
39,"president, vote, previous, clown, fat",1,2023-03-01
40,"referee, advised, negreira, biggest, stadium",2,2023-03-01
41,"pel, youth, gonzlez, player, barsa",1,2023-03-01
42,"irregular, enrquez, negreira, payment, bara",2,2023-03-01
43,"slave, girl, #corruptos, #mafiosos, #ladrones",3,2023-03-01
44,"awards, negreira, today, egreira, hijoooooossss",1,2023-03-01
46,slave,2,2023-03-01
47,"remember, negreira, tito, berni, smokescreen",3,2023-03-01
49,"league, negreira, @liga, discarded, egreira",4,2023-03-01
50,"ancelotti, corruption, case, classic, negreira",13,2023-03-01
51,"@alfonsotrallero, podcast, preview, answer, video",4,2023-03-01
52,"pelopincho, create, parents, egreira, god",1,2023-03-01
54,"boy, negreira, egreira, bod, gangz",1,2023-03-01
0,"barsa, madrid, play, goal, win",3737,2023-03-02
1,"negreira, egreira, thing, today, alive",268,2023-03-02
2,"yellow, vinicius, negreira, gavi, card",197,2023-03-02
3,"arbitration, case, negreira, investigation, rfef",130,2023-03-02
4,"cash, month, euros, withdrew, collection",77,2023-03-02
5,"estrada, fernndez, var, referee, lawsuit",108,2023-03-02
6,"referee, negreira, egreira, match, today",108,2023-03-02
7,"gavi, negreira, card, thing, son",91,2023-03-02
8,"egreira, negreira, fault, case, worse",61,2023-03-02
9,"case, negreira, nieto, civil, pez",63,2023-03-02
10,"#realmadridbarcelona, negreira, @realmadrid, #realmadridbara, #copadelrey",57,2023-03-02
11,"withdrew, cash, euros, month, collection",41,2023-03-02
12,"boy, negreira, egreira, fucking, unpresentable",60,2023-03-02
13,"estrada, fernndez, cta, negreira, lawsuit",55,2023-03-02
14,"uefa, case, federation, negreira, rfef",43,2023-03-02
15,"negreira, beat, today, game, team",45,2023-03-02
16,"referee, cantalejo, medina, negreira, dishonest",37,2023-03-02
17,"bara, case, negreira, cluster, impact",24,2023-03-02
18,"negreira, egreira, club, palancas, boy",45,2023-03-02
19,"negreira, pay, payment, paid, salary",44,2023-03-02
20,"uefa, sanctioning, fifa, bara, afraid",25,2023-03-02
21,"santiago, banknotes, federation, bernabu, face",37,2023-03-02
22,"goal, negreira, goa, great, egreira",35,2023-03-02
23,"arbitration, negreira, time, gavi, overcome",37,2023-03-02
24,"madrid, real, negreira, case, fans",24,2023-03-02
25,"bernabu, bernabeu, fly, egreira, spirit",29,2023-03-02
26,"cta, negreira, cantalejo, medina, president",25,2023-03-02
27,"#baragate, negreira, #barcagate, bara, talk",21,2023-03-02
28,"espai, investors, bara, suffering, case",8,2023-03-02
29,"fans, bernabu, madrid, protest, santiago",27,2023-03-02
30,"banknotes, face, laporte, classic, distribut",22,2023-03-02
31,"munuera, negreira, bizum, montero, received",26,2023-03-02
32,"barsa, arbitration, robbery, president, vice",24,2023-03-02
33,"cup, egreira, negreira, hahahahahahahahahahahahahaha, bon",21,2023-03-02
34,"rfef, report, knowing, fact, person",23,2023-03-02
35,"cantalejo, medina, negreira, @ctarfef, press",20,2023-03-02
36,"negreira, enriquez, enrquez, wimp, maria",15,2023-03-02
37,"corruption, madrid, negreira, federation, spain",15,2023-03-02
38,"#golazo, thing, negreira, #asiganaelmadrid, trapper",16,2023-03-02
39,"negreira, vice, president, corruption, cta",19,2023-03-02
40,"referee, bara, bought, negreira, details",17,2023-03-02
41,"gonzlez, dangerous, nou, var, camp",16,2023-03-02
42,"barcelona, alleged, payment, crimes, envision",13,2023-03-02
43,"slave, girl, #corruptos, #mafiosos, #ladrones",14,2023-03-02
44,"negreira, today, egreira, hijoooooossss, lasts",15,2023-03-02
45,"beep, negreira, egreira, cabr, temite",16,2023-03-02
46,slave,13,2023-03-02
47,"uncle, tito, berni, negreira, egreira",11,2023-03-02
48,"prosecutor, public, office, final, bartomeu",12,2023-03-02
49,"egreira, league, negreira, grande, strong",11,2023-03-02
50,"ancelotti, case, classic, negreira, corruption",2,2023-03-02
51,"madrid, real, egypt, #photography, bukele",9,2023-03-02
52,"parents, egreira, exist, negreira, embryo",13,2023-03-02
53,"refused, collaboration, clarify, rfef, report",12,2023-03-02
54,"boy, egreira, bod, gangz, jack",10,2023-03-02
55,"rolex, wear, denies, medina, cantalejo",11,2023-03-02
0,"barsa, madrid, play, win, goal",173,2023-03-03
1,"negreira, hahahahahahaj, oooooooooo, cheer, order",2,2023-03-03
2,"vinicius, yellow, negreira, jong, gavi",6,2023-03-03
3,"arbitration, case, negreira, andreu, rfef",6,2023-03-03
4,"month, mom, straw, sergio, custody",2,2023-03-03
5,"estrada, fernndez, complaint, referee, prosecutor",9,2023-03-03
6,"referee, negreira, madrid, work, charge",5,2023-03-03
7,"gavi, negreira, card, bowels, chipmunks",3,2023-03-03
8,"egreira, negreira, munuera, likes, transfer",8,2023-03-03
9,"middle, #halamadrid, case, continue, pay",1,2023-03-03
10,"negreira, @realmadrid, #chiringuitotitular, illustration, #chiringuitoclasico",3,2023-03-03
13,"complaint, fernndez, estarada, reaffirm, procedure",1,2023-03-03
14,"uefa, federation, spanish, request, rfef",6,2023-03-03
15,"negreira, dragon, felt, beat, worst",2,2023-03-03
17,"affect, banned, case, increasingly, biggest",2,2023-03-03
18,"negreira, burgos, exhibition, play, yesterday",1,2023-03-03
19,"fara, pay, pass, montero, munuera",1,2023-03-03
20,"uefa, sanctioning, case, sports, bara",7,2023-03-03
21,"federation, face, fans, protest, tickets",3,2023-03-03
22,"goal, score, push, small, negreira",1,2023-03-03
23,"essential, arbitration, palancas, double, media",1,2023-03-03
24,"madrid, #casomediador, @ppopular, sky, scream",1,2023-03-03
27,"#barcagate, loss, negreira, post, machine",2,2023-03-03
29,"dozens, fans, demonstrated, madrid, @marca",1,2023-03-03
30,"banknotes, face, laporte, classic, crying",3,2023-03-03
35,"medina, assembly, cantalejo, pantomime, spectators",1,2023-03-03
36,"enriquez, negreira, enrquez, wimp, maria",1,2023-03-03
37,"government, fraga, galicia, feijo, vigo",2,2023-03-03
40,"charge, bought, spain, referee, negreira",1,2023-03-03
42,"#ocio, accused, advised, barcelona, enrquez",1,2023-03-03
46,slave,1,2023-03-03
48,"public, prosecutor, bartomeu, office, final",3,2023-03-03
